cleand_text,amazon_transcribe,azure,azure_whisper,mms,seamless,V1_latest_short,V2_short,V2_chirp,V2_chirp_2,whisper_base,whisper_medium,whisper_turbo,리턴제로(vito),한국전자통신연구원(etri)
우리 오늘 쇼핑하러 갈까?,우리 오늘 쇼핑하러 갈까?,우리 오늘 쇼핑하러 갈까?,우리 오늘 쇼핑하러 갈까?,우리 오늘 쇼핑하로 갈가,우리 오늘 쇼핑하러 갈까?,우리 오늘 쇼핑하러 갈까?,우리 오늘 쇼핑하러 갈까?, 우리 오늘 쇼핑하러 갈까?,우리 오늘 쇼핑하러 갈까?, 우리 오늘 쇼핑하러 갈까?, 우리 오늘 쇼핑하러 갈까?, 우리 오늘 쇼핑하러 갈까?,우리 오늘 쇼핑하러 갈까?,우리 오늘 쇼핑하러 갈까?
아침마다 조깅을 하니까 엄지발가락에 군살이 겁나게 생겼어.,아침마다 조깅을 하니까 엄지 발가락에 군 살이 겁나게 생겼어,아침마다 조깅을 하니까 엄지발가락에 군살이 겁나게 생겼어.,아침마다 조깅을 하니까 엄지발가락에 군살이 겁나게 생겼어.,아지마다 조긴을 하니까 엄지발가락게 군사리 검락게 생겼소,아침마다 조을 하니까 엄지발가락에 군살이 겁나게 생겼어.,아침마다 조깅을 하니까 엄지발가락에 군살이 겁나게 생겼어.,아침마다 조깅을 하니까 엄지발가락에 군살이 겁나게 생겼어., 아침마다 조딩을 하니까 엄지 발가락에 군살이 겁나게 생겼어.,아침마다 조깅을 하니까 엄지발가락에 군살이 겁나게 생겼어., 아침마다 조깅을 하니까 엄지발가락에 군살이 겁나게 생겼어., 아침마다 조깅을 하니까 엄지발가락에 군살이 겁나게 생겼어, 아침마다 조깅을 하니까 엄지발가락에 군살이 겁나게 생겼어.,아침마다 조깅을 하니까 엄지발가락에 군살이 겁나게 생겼어.,아침마다 조깅을 하니까 엄지발가락에 군살이 겁나게 생겼어
좋아하는 일을 하고 싶다가도 돈을 생각하면 약간 멈칫하게 되더라.,좋아하는 일을 하고 싶다가도 돈을 생각하면 약간 멈칫 하게 되더라.,좋아하는 일을 하고 싶다가도 돈을 생각하면 약간 멈칫하게 되더라.,좋아하는 일을 하고 싶다가도 돈을 생각하면 약간 멈칫하게 되더라.,조안는 일을 하고 십다가도 돈을 생각하면 약간 멈치탁에 되돌라,좋아하는 일을 하고 싶다가도 돈을 생각하면 약간 멈게 되더라.,좋아하는 일을 하고 싶다가도 돈을 생각하면 약간 멈칫하게 되.,좋아하는 일을 하고 싶다가도 돈을 생각하면 약간 멈칫하게 되더라., 좋아하는 일을 하고 싶다가도 돈을 생각하면 약간 멈칫하게 되더라.,좋아하는 일을 하고 싶다가도 돈을 생각하면 약간 멈칫하게 되더라., 좋아하는 일을 하고 싶다가도 돈을 생각하면 멈췄하게 되더라., 좋아하는 일을 하고 싶다가도 돈을 생각하면 약간 멈칫하게 되더라, 좋아하는 일을 하고 싶다가도 돈을 생각하면 약간 멈칫하게 되더라.,좋아하는 일을 하고 싶다가도 돈을 생각하면 약간 멈칫하게 되더라.,좋아하는 일을 하고 싶다가도 돈을 생각하면 약간 멈칫하게 되더라고요.
여기서 잠시 기다리세요 곧 돌아올게요.,여기서 잠시 기다리세요. 곧 돌아올게요,여기서 잠시 기다리세요. 곧 돌아올게요.,여기서 잠시 기다리세요. 곧 돌아올게요.,여기서 잠시 기따리 되어 곧 돌아 올개요,여기서 잠시 기다리세요 곧 돌아올게요,여기서 잠시 기다리세요 곧 돌아올게요.,여기서 잠시 기다리세요 곧 돌아올게요., 여기서 잠시 기다리세요. 곧 돌아올게요.,여기서 잠시 기다리세요. 곧 돌아올게요., 여기서 잠시 기다리세요. 곧 돌아올게요, 여기서 잠시 기다리세요. 곧 돌아올게요., 여기서 잠시 기다리세요. 곧 돌아올게요.,"여기서 잠시 기다리세요, 곧 돌아올게요.",여기서 잠시 기다리세요. 곧 돌아 올게요.
나 책상 옮기는 것 좀 도와줄래?,나 책상 옮기는 것 좀 도와 줄래?,나 책상 옮기는 것 좀 도와줄래?,나 책상 옮기는 것 좀 도와줄래?,나책 상 옮계는 것은 도와 준래,나 책상 옮기는 것 좀 도와줄래?,나 책상 옮기는 것 좀 도와 줄래?,나 책상 옮기는 것 좀 도와 줄래?, 나 책상 옮기는 것 좀 도와줄래?,나 책상 옮기는 것 좀 도와 줄래?, 나 책상 옮기는 것 좀 도와줄래?, 나 책상 옮기는 것 좀 도와줄래?, 나 책상 옮기는 것 좀 도와줄래?,나 책상 옮기는 것 좀 도와줄래?,나 책상 옮기는 것 좀 도와줄래?
우와 너 농구도 잘해?? 못하는 운동이 머야?,우와 너 농구도 잘해 못 하는 운동이 뭐야?,우와 너 농구도 잘해 못하는 운동이 뭐야?,"우와, 너 농구도 잘해? 못하는 운동이 뭐야?",오아 또 농구저 잘래 보타는 온동이 모야,"와, 너 농구조 잘해? 못하는 운동이 뭐야?",우와 너 농구도 잘해 못 하는 운동이 뭐야?,우와 너 농구도 잘해.," 우와, 너 농구조 잘해? 못하는 운동이 뭐야?","우와, 너 농구도 잘해? 못 하는 운동이 뭐야?", 우와.. 너 눈구조 잘해? 못하는 운동이 뭐야?, 우와 너 농구조 잘해? 못하는 운동이 뭐야?, 우와 너 농구조 잘해? 못하는 운동이 뭐야?,우와 너 농구저 잘해 못하는 운동이 뭐야?,너 농구도 잘해? 못하는 운동이 뭐야?
오늘은 정장을 입고 오셨네요 오늘 선 보십니까?,오늘은 정장을 입고 오셨네요 오늘 선 보십니까?,"오늘은 정장을 입고 오셨네요, 오늘 선보십니까?",오늘은 정장을 입고 오셨네요. 오늘 선보십니까?,오늘은 정장의 입고 션내여 오늘 선보십니까,오늘은 정장을 입고 오셨네요. 오늘 선보이십니까?,오늘은 정장을 입고 오셨네요 오늘 선 보십니까?,오늘은 정장을 입고 오셨네요 오늘 선 보십니까?, 오늘은 정장을 입고 오셨네요. 오늘 선보십니까?,오늘은 정장을 입고 오셨네요. 오늘 선부십니까?, 오늘은 정장을 입고 오셨네요. 오늘 선보셨습니까?, 오늘은 정장을 입고 오셨네요. 오늘 선보여십니까?, 오늘은 정장을 입고 오셨네요 오늘 선보십니까,오늘은 정장을 입고 오셨네요. 오늘 선보십니까?,오늘은 정장을 입고 오셨네요. 오늘 선보십니까?
아들 오늘 저녁 메뉴는 뭐로 할까? 김치찌개로 할까? 네가 좋아하잖아.,아들 오늘 저녁 메뉴는 뭐로 할까? 김치 찌개로 할까? 네가 좋아하잖아,"아들, 오늘 저녁 메뉴는 뭐로 할까?",아들 오늘 저녁 메뉴는 뭐로 할까? 김치찌개로 할까? 니가 좋아하잖아,아들 오늘 저형 매유는 머로 할가 김짓치게로 할까 니가 좋아하아나,"아들, 오늘 저녁 메뉴는 뭐로 할까? 김지치개로 할까? 네가 좋아하잖아.",아들 오늘 저녁 메뉴는 뭐로 할까 김치찌개로 할까 네가 좋아하잖아.,아들 오늘 저녁 메뉴는 뭐로 할까?," 아들, 오늘 저녁 메뉴는 뭐로 할까? 김치치게로 할까? 네가 좋아하잖아.",아들 오늘 저녁 메뉴는 뭐로 할까? 김치찌개로 할까? 네가 좋아하잖아., 아들 오늘 저녁 메뉴는 뭐로 할까? 김치찌개로 할까? 네가 좋아하잖아, 아들 오늘 저녁 메뉴는 뭐로 할까? 김치찌개로 할까? 니가 좋아하잖아, 아들 오늘 저녁 메뉴는 뭐로 할까? 김치찌개로 할까? 네가 좋아하잖아.,아들 오늘 저녁 메뉴는 뭐로 할까 뭐 김치찌개로 할까 니가 좋아하잖아.,아들 오늘 저녁 메뉴는 뭐로 할까? 김치 찌개로 할까? 니가 좋아하잖아.
나 버스 탔는데 옆에 계시던 아주머니가 막 허리에 손을 갖다 대길래.,나 버스 탔는데 옆에 계시던 아주머니가 막 허리에 손을 갖다 대 길래.,나 버스 탔는데 옆에 계시던 아주머니가 막 허리에 손을 갖다 대길래.,나 버스 탔는데 옆에 계시던 아주머니가 막 허리에 손을 갖다 대길래,나버스터는데 여에 계치던 아주무안니가 막허리에 손을 헛다되길내에,나 버스 는데 에 계시던 아머니가 막 허리에 손을 다 길래,나 버스 탔는데 옆에 계시던 아주머니가 막 허리에 손을 갖다 대길.,나 버스 탔는데 옆에 계시던 아주머니가 막 허리에 손을 갖다 대길래., 나 버스 탔는데 옆에 계시던 아주머니가 막 허리에 손을 갖다 대길래.,나 버스 탔는데 옆에 계시던 아주머니가 막 허리에 손을 갖다 대길래, 나버 스타인데 옆에 계시던 아주머니가 막 허리에 손을 갖다 제길래, 나 버스 탔는데 옆에 계시던 아주머니가 막 허리에 손을 갖다대길래, 나 버스 탔는데 옆에 계시던 아주머니가 허리에 손을 갖다 대길래.,나 버스 탔는데 옆에 계시던 아주머니가 막 허리에 손을 갖다대길래.,나 버스 탔는데 옆에 계시던 아주머니가 막 허리에 손을 갖다대길래
서면에서 옷 사야 되는데 내일 같이 가서 골라줄 수 있어?,서면에서 옷 어야 되는데 내일 같이 가서 골라 줄 수 있어?,서면에서 옷 사야 되는데 내일 같이 가서 골라줄 수 있어?,서면에서 옷 사야 되는데 내일 같이 가서 골라줄 수 있어?,서면에서 오쓰아 되는 데내일 가치가서 골라을 수 있슷다,서면에서 옷 야 되는 데마다 같이 가서 골라줄 수 있어?,서면에서 옷 사야 되는데 내일 같이 가서 골라 줄 수 있어.,서면에서 옷 사야 되는데 내일 같이 가서 골라 줄 수 있어., 서면에서 옷 싸야 되는데 내일 같이 가서 골라 줄 수 있어?,서면에서 옷 사야 되는데 내일 같이 가서 골라 줄 수 있어?, 서면에서 옷을 써야 되는데 같이 가서 골라줄 수 있어., 서면에서 옷 사야 되는데 내일 같이 가서 골라줄 수 있어?, 서면에서 옷 사야 되는데 내일 같이 가서 골라줄 수 있어?,서면에서 옷 사야 되는데 내일 같이 가서 골라줄 수 있어.,서면에서 옷 써야 되는데 내일 같이 가서 골라줄 수 있어?
이번 주에 조카 보러 와주지 않을래? 이쁜 조카들이 기다리고 있어.,이번 주에 조카 보러 와 주지 않을래? 이쁜 조카들이 기다리고 있어,이번주에 조카보로 와주지 않을래? 이쁜 조카들이 기다리고 있어.,이번주에 조카보러 와주지 않을래? 이쁜 조카들이 기다리고 있어,이번주 족화버로 와주지 않을내 입쁜 족하들이 기다리고 있다,이번 주 조카보러 와주지 않을래? 예쁜 조카들이 기다리고 있어!,이번 주 조카 보러 와 주지 않을래 이쁜 조카들이 기다리고 있어.,이번 주에 조카 보러 와 주지 않을래?, 이번 주에 조카 보러 와주지 않을래? 이쁜 조카들이 기다리고 있어.,이번 주에 조카 보러 와주지 않을래? 이쁜 조카들이 기다리고 있어., 이번 주의 조카보로 와주지 않을래? 이쁜 조카들이 기다리고 있어, 이번주에 조카보러 와주지 않을래? 예쁜 조카들이 기다리고 있어, 이번 주에 조카 보러 와주지 않을래? 이쁜 조카들이 기다리고 있어.,이번 주에 조카 보러 와주지 않을래 이쁜 조카들이 기다리고 있어.,이번 주에 조카 보러 와주지 않을래 이쁜 조카들이 기다리고 있어.
이빨이 썩어서 신경치료를 해야 하는데 아프지 않을까?,이빨이 썩어서 신경 치료를 해야 하는데 아프지 않을까?,이빨이 썩어서 신경치료를 해야 하는데 아프지 않을까?,이빨이 썩어서 신경치료를 해야 하는데 아프지 않을까?,입발이 서어서 신경치류를 해야 하는데 아프지 않늘까,이빨이 어서 신경치료를 해야 하는데 아프지 않을까?,이빨이 썩어서 신경 치료를 해야 하는데 아프지 않을까?,이빨이 썩어서 신경 치료를 해야 하는데 아프지 않을까?," 이빨이 썩어서 신경 치료를 해야 하는데, 아프지 않을까?",발이 썩어서 신경 치료를 해야 하는데 아프지 않을까?, 이 발이 쏙어서 신경 치료를 해야 하는데 아프지 않을까?, 백발이 썩어서 신경치료를 해야 하는데 아프지 않을까?, 이빨이 썩어서 신경 치료를 해야 하는데 아프지 않을까,깃발이 썩어서 신경치료를 해야 하는데 아프지 않을까?,이빨이 썩어서 신경 치료를 해야 하는데 아프지 않을까?
내일 먹을 얼음 없어가지고 얼음 좀 얼려놔야겠다.,내일 먹을 얼음 없어 가지고 얼음 좀 얼려 놔야겠다,내일 먹을 얼음 없어가지고 얼음 좀 얼려놔야겠다.,내일 먹을 얼음 없어서 얼음 좀 얼려놔야겠다.,내일 먹을 어름 없서가 주고 어름 좀 얼려나야겠다,내일 먹을 얼음 없어가지고 얼음 좀 올려야겠다.,내일 먹을 얼음 없어 가지고 얼음 좀 얼려 놔야겠다.,내일 먹을 얼음 없어 가지고 얼음 좀 얼려 놔야겠다., 내일 먹을 얼음 없어 가지고 얼음 좀 얼려 놔야겠다.,내일 먹을 얼음 없어 가지고 얼음 좀 얼려 놔야겠다., 내일 먹을 얼음 없어서 얼음 좀 올려놔야겠다., 내일 먹을 얼음 없어가지고 얼음 좀 얼려놔야겠다, 내일 먹을 얼음 없어가지고 얼음 좀 얼려놔야겠다.,내일 먹을 얼음 없어가지고 얼음 좀 얼려놔야겠.,내일 먹을 얼음 없어가지구 얼음 좀 얼려 놔야겠다.
밖에 무슨 일 있나? 경철 차가 지나가노.,밖에 무슨 일 있나 경찰차가 지나가고,밖에 무슨 일 있나 경찰차가 지나간 후.,밖에 무슨 일 있나 경찰차가 지나가노,박개 무슨 일인나 경찰차가 지나가후,"밖에 무슨 일이 있나, 경찰차가 지나가노?",밖에 무슨 일 있나 경찰차가 지나가.,밖에 무슨 일 있나 경찰차가 지나가니., 밖에 무슨 일 있나? 경찰차가 지나가노.,밖에 무슨 일 있나? 경찰차가 지나가노., 밖에 무슨 일 있나? 경찰차가 지나가나, 밖에 무슨 일 있나 경찰차가 지나가노, 밖에 무슨 일 있나? 경찰차가 지나가노.,밖에 무슨 일 있나? 경찰차가 지나가노.,밖에 무슨 일 있나 경찰차가 지나가노.
아 제가 아직 명함을 안 만들어갖고 다음에 드리겠습니다.,"아, 제가 아직 명함을 안 만들어 갖고 다음에 드리겠습니다.",아 제가 아직 명함을 안 만들어 갔고 다음에 드리겠습니다.,아 제가 아직 명함을 안만들어갖고 다음에 드리겠습니다,아체가 아식 명함을럼만들어 같고 다음에 드리겠습니다,"아, 제가 아직 명화물 안 만들어갔고, 다음에 드리겠습니다.",아 제가 아직 명함을 안 만들어 갖고 다음에 드리겠습니다.,아 제가 아직 명함을 안 만들어 갖고 다음에 드리겠습니다.," 아, 제가 아직 명함을 안 만들어 갖고 다음에 드리겠습니다.",아 제가 아직 명함을 안 만들어 갖고 다음에 드리겠습니다., 아 제가 아직 명함을 안 만들어서 다음 해드리겠습니다, 제가 아직 명암을 안 만들어서 다음에 드리겠습니다, 제가 아직 명함을 안 만들어 갖고 다음에 드리겠습니다.,"아, 제가 아직 명함을 안 만들어 갖고 다음에 드리겠습니다.",아 제가 아직 명함을 안 만들어 갖고 다음에 드리겠습니다.
이건 사업상 거래였고 너에게도 목적 있었지만 이제 이 거래는 끝났어.,이건 사업상 거래 였고 너에게 목적이 있었지만 이제 이 거래는 끝났어,이건 사업성 거래였고 너에게도 목적이 있었지만 이제 이 거래는 끝났어.,이건 사업상 거래였고 너에게도 목적이 있었지만 이제 이 거래는 끝났어.,이건 사업산거려었고 노에게도 먹적이 있었지만 이제 이어에는 끝났소,이건 사업상 거래였고 너에게도 목적이 있었지만 이제 이 거래는 끝났어!,이건 사업상 거래였다.,이건 사업성 거리였고 너에게도 목적이 있었지만 이제 이거를.," 이건 사업상 거래였고, 너에게도 목적이 있었지만, 이제 이 거래는 끝났어.",이건 사업상 거래였고 너에게도 목적이 있었지만 이제 이 거래는 끝났어., 이건 사업선거래였고 너에게도 목적이셨지만 이제 이거래는 끝났어," 이건 사업상 거래였고 너에게도 목적이 있었지만, 이제 이 거래는 끝났어.", 이건 사업상 거래였고 너에게도 목적이 있었지만 이제 이 거래는 끝났어.,"이건 사업상 거래였고, 너에게도 목적이 있었지만 이제 이 거래는 끝났어.",이건 사업상 거래였고 너에게도 목적이 있었지만 이제 이 거래는 끝났어.
스트레스 많이 받았었나 봐. 저렇게 울 정도일 줄은 몰랐어.,스트레스 많이 받았었나 봐 저렇게 울 정도인 줄은 몰랐어,스트레스 많이 받았었나 봐 저렇게 울 정도인 줄 몰랐어.,진짜 많이 받았었나봐. 저렇게 울 정도인 줄은 몰랐어.,스투스 많이바다손나바 저록게 울정돌은 줄은 몰랐소,스트레스 많이 받았었나 봐 저렇게 울 정도인 줄 몰랐어.,많이 받았었어 저렇게 울 정도인 줄은 몰랐어.,많이 받았었어 저렇게 울 정도인 줄은 몰랐어., 스트레스 많이 받았었나 봐. 저렇게 울 정도인 줄 몰랐어.,수수수 많이 받았었나 봐. 저렇게 울 정도인 줄은 몰랐어., 진짜 많이 받았었나 봐. 저렇게 울 정도는 줄 몰랐어., 스탯스탯 많이 받았었나봐 저렇게 울 정도인 줄은 몰랐어, 스트레스 많이 받았었나 봐. 저렇게 울 정도인 줄은 몰랐어.,"스스 많이 받았었나봐, 저렇게 울 정도인 줄은 몰랐어.",스트레스 많이 받았었나 봐. 저렇게 울 정도인 줄은 몰랐어.
그렇게 눈이 부시던 순간들이 지나고 모든 게 변해버렸지.,그렇게 눈이 보시던 순간들이 지나고 모든 게 변해 버렸지.,그렇게 눈이 부시던 순간들이 지나고 모든 게 변해 버렸지.,그렇게 눈이 부시던 순간들이 지나고 모든 게 변해버렸지.,그렇게 눈이 부시던 순간들이 지하고 모든계에 변해버렸지,그렇게 눈이 부시던 순간들이 지나고 모든 게 변해버렸지.,그렇게 눈이 부시던 순간들이 지나고 모든게 변해 버렸지.,그렇게 눈이 부시던 순간들이 지나고 모든게 변해 버렸지., 그렇게 눈이 부시던 순간들이 지나고 모든 게 변해 버렸지.,그렇게 눈이 부시던 순간들이 지나고 모든게 변해 버렸지., 그렇게 눈이 부시다는 순간 들이 지나고 모든게 편해버렸지, 그렇게 눈이 부시던 순간들이 지나고 모든 게 변해버렸지., 그렇게 눈이 부시던 순간들이 지나고 모든 게 변해버렸지.,그렇게 눈이 부시던 순간들이 지나고 모든 게 변해버렸지.,그렇게 눈이 부시던 순간들이 지나고 모든 게 변해버렸지
오늘 7시에 영화 예매해두면 될까?,오늘 일곱 시에 영화 예매해 두면 될까?,오늘 일곱시에 영화 예매해두면 될까?,오늘 7시에 영화 예매해두면 될까?,오늘 이곱시의 용화 예매두면 될가,오늘 일곱시에 영화 예매해두면 될까?,오늘 7시에 영화 예매 두면 될까?,오늘 7시에 영화 예매 두면 될까?, 오늘 7시에 영화 예매해 두면 될까?,오늘 7시에 영화 예매해 두면 될까?, 오늘 7시에 영화 개매해두면 될까?, 오늘 7시에 영화 예매해두면 될까?, 오늘 7시에 영화 예매해두면 될까?,오늘 일곱 시에 영화 예매해 두면 될까?,오늘 일곱시에 영화 예매해 두면 될까?
피자 먹고 싶다 어디 피자 좋아해? 나는 도미노 피자가 좋더라.,피자 먹고 싶다 어디 피자 좋아해? 너는 도미노 피자가 좋더라,딱 피자 먹고 싶다 어디 피자 좋아해? 나는 도미노 피자가 좋더라.,피자 먹고 싶다. 어디 피자 좋아해? 나는 도미노 피자가 좋더라.,피자먹고십다 오디 피자 조아에 나는 도민노 피자가 좋더라,피자 먹고 싶다. 어디 피자 좋아해? 나는 도미노 피자가 좋더라.,피자 먹고 싶다 어디 피자 좋아해 나는 도미노피자가 좋더라.,피자 먹고 싶다., 피자 먹고 싶다. 어디 피자 좋아해? 나는 도미노 피자가 좋더라.,피자 먹고 싶다. 어디 피자 좋아해? 나는 도미노 피자가 좋더라., 피자 먹고 싶다. 어디 피자 좋아해? 나는 도민호 피자가 좋더라., 피자 먹고 싶다 어디 피자 좋아해? 나는 도미노 피자가 좋더라, 피자 먹고 싶다. 어디 피자 좋아해? 나는 도미노 피자가 좋더라.,"피자 먹고 싶다, 어디 피자 좋아해 나는 도미노 피자가 좋더라.",피자 먹고 싶다. 어디 피자 좋아해? 나는 도미노 피자가 좋더라.
흑임자떡이랑 인절미 떡 둘 중에서 뭐 먹지? 너무 고민돼.,흑인 자 떡이랑 인절미 떡 둘 중에서 뭐 먹지? 너무 고민돼,흑임자떡이랑 임절미떡 둘 중에서 뭐 먹지? 너무 고민돼.,흑임자떡이랑 인절미떡 둘 중에서 뭐 먹지? 너무 고민돼,크임자더이 랑 인절미덕 둘중에서 모먹지 너무 고민된,흑자이랑 임절미 둘 중에서 뭐 먹지? 너무 고민돼,흑임자 떡이랑 인절미 떡 둘 중에서 뭐 먹지 너무 고민돼.,흑임자 떡이랑 인절미 떡 둘 중에서 뭐 먹지 너무 고민돼., 흑임자 떡이랑 인절미 떡 둘 중에서 뭐 먹지? 너무 고민돼.,흑임자떡이랑 인절미떡 둘 중에서 뭐 먹지? 너무 고민돼., 흑임 잡닥이랑 인절미 떡 둘 중에서 뭐 먹지? 너무 고민돼, 흑임자떡이랑 인절미떡 둘 중에서 뭐 먹지? 너무 고민돼, 흑임자떡이랑 인절미 떡 둘 중에서 뭐 먹지? 너무 고민돼.,흑임자떡이랑 인절미떡 둘 중에서 뭐 먹지 너무 고민돼.,흑임자 떡이랑 인절미 떡 둘 중에서 뭐 먹지? 너무 고민돼.
배고픈데 우리 치킨 시켜 먹을까?,배고픈데 우리 치킨 시켜 먹을까,배고픈데 우리 치킨 시켜 먹을까?,배고픈데 우리 치킨 시켜먹을까?,배국분데 우리 지힌 지 켜먹구 했까,배고픈데 우리 치킨 시켜 먹을까?,배고픈데 우리 치킨 시켜 먹을까?,배고픈데.," 배고픈데, 우리 치킨 시켜 먹을까?",배고픈데 우리 치킨 시켜 먹을까?, 배고픈데 우리 치킨 시켜먹을까?, 배고픈데 우리 치킨 시켜 먹을까?, 배고픈데 우리 치킨 시켜 먹을까?,배고픈데 우리 치킨 시켜 먹을까?,배고픈데 우리 치킨 시켜 먹을까?
다이어트를 하는데 생리와 겹쳐서 걱정이야.,다이어트를 하는데 생리가 겹쳐서 걱정이야.,다이어트를 하는데 생리와 겹쳐서 걱정이야.,다이어트를 하는데 생리와 겹쳐서 걱정이야.,다이여트를 하는데에 생리와 겹쳐서 걱종이야,다이어트를 하는데 생리와 쳐서 걱정이야,다이어트를 하는데 생리와 겹쳐서 걱정이야.,다이어트를 하는데 생리와 겹쳐서 걱정이야., 다이어트를 하는데 생리와 겹쳐서 걱정이야.,다이어트를 하는데 생리와 겹쳐서 걱정이야., 다이어트를 하는데 생리와 겹쳐서 걱정이야, 다이어트를 하는데 생리와 겹쳐서 걱정이야, 다이어트를 하는데 생리와 겹쳐서 걱정이야.,다이어트를 하는데 생리와 겹쳐서 걱정이야.,다이어트를 하는데 생리와 겹쳐서 걱정이야.
근데 요즘 계속 걔랑 같이 집 가네? 질투 나려고 해.,근데 요즘 계속 걔랑 같이 집 가해 질투 하려고 해,근데 요즘 계속 걔랑 같이 집 가네 질투 나려고 해.,근데 요즘 계속 걔랑 같이 집 가네? 질툰 하려고 해,그데 요중 계속 개랑같이 집간에 즐튼하려고해,근데 요즘 계속 계란 같이 집간에 질투하려고 해.,근데 요즘 계속 걔랑 같이 집 가네 질투 나려고 해.,근데 요즘 계속 걔랑 같이 집 가네 질투 나려고 해., 근데 요즘 계속 개랑 같이 집간에 질투 하려고 해.,근데 요즘 계속 개랑 같이 집 가네? 질투나려고 해., 근데 요즘 계속 계란같이 집가네? 질트나려고 해, 근데 요즘 계속 걔랑 같이 집 가네? 질투나려고 해, 근데 요즘 계속 걔랑 같이 집 가네 질투 나려고 해,근데 요즘 계속 걔랑 같이 집간네 질툰하려고 해.,그런데 요즘 계속 걔랑 같이 집간에 질투 나려고 해.
