cleand_text,amazon_transcribe,azure,azure_whisper,mms,seamless,V1_latest_short,V2_short,V2_chirp,V2_chirp_2,whisper_base,whisper_medium,whisper_turbo,리턴제로(vito),한국전자통신연구원(etri)
인터넷에 너무 나쁜 댓글들이 많다. 조금 지워줬으면 좋겠는데.,인터넷에 너무 나쁜 댓글들이 많다. 조금 지워 줬으면 좋겠는데.,인터넷에 너무 나쁜 댓글들이 많다. 조금 지어줬으면 좋겠는데.,인터넷에 너무 나쁜 댓글들이 많다. 조금 지워줬으면 좋겠는데.,인터에에 너은 아쁜 대끗리들이 만타 쪽금 취어조음으 주겠는데,인터넷에 너무 나쁜 글들이 많다. 조금 지워으면 좋겠는데,인터넷에 너무 나쁜 댓글들이 많다. 조금 지워 줬으면 좋겠는데.,인터넷에 너무 나쁜 댓글들이 많다., 인터넷에 너무 나쁜 댓글들이 많다. 조금 지어 줬으면 좋겠는데.,인터넷에 너무 나쁜 댓글들이 많다. 조금 지워 줬으면 좋겠는데., 인터넷은 너무 나쁜데 그리들이 많다 조금 지워졌으면 좋겠는데, 인터넷에 너무 나쁜 댓글들이 많다 조금 지어줬으면 좋겠는데, 인터넷에 너무 나쁜 댓글들이 많다 조금 지어줬으면 좋겠는데,인터넷에 너무 나쁜 댓글들이 많다. 조금 지어줬으면 좋겠는데.,인터넷에 너무 나쁜 댓글들이 많다 조금 지워줬으면 좋겠는데
저는 영어는 물론 일본어도 말할 수 있어요.,저는 영어는 물론 일본어도 말할 수 있어요,저는 영어는 물론 일본어도 말할 수 있어요.,저는 영어는 물론 일본어도 말할 수 있어요.,전은 영원는 물론 일본화도 말할 수 있싸여,저는 영어는 물론 일본어도 말할 수 있어요.,저는 영어는 물론 일본어도 말할 수 있어요.,저는 영어는 물론 일본어로 말할 수 있어요., 저는 영어는 물론 일본어도 말할 수 있어요.,저는 영어는 물론 일본어도 말할 수 있어요., 저는 영어는 물론 일본어도 말할 수 있어요, 저는 영어는 물론 일본어도 말할 수 있어요., 저는 영어는 물론 일본어도 말할 수 있어요.,저는 영어는 물론 일본어도 말할 수 있어요.,저는 영어는 물론 일본어도 말할 수 있어요.
그녀는 몸이 약한지 감기에 쉽게 걸려버린다.,그녀는 몸이 약한 지 감기에 쉽게 걸려 버린다.,그녀는 몸이 약한지 감기에 쉽게 걸려버린다.,그녀는 몸이 약한지 감기에 쉽게 걸려버린다.,그년는 몸이 악한지 감기의 쉽개 걸려버린다,그녀는 몸이 약한지 감기에 쉽게 걸려버린다.,그녀는 몸이 약한지 감기에 쉽게 걸려 버린다.,그녀는 몸이 약한지 감기에 쉽게 걸려 버린다., 그녀는 몸이 약한지 감기에 쉽게 걸려 버린다.,그녀는 몸이 약한지 감기에 쉽게 걸려 버린다., 그녀는 몸이 약한 지 감기에 쉽게 걸려버린다., 그녀는 몸이 약한지 감기에 쉽게 걸려버린다., 그녀는 몸이 약한지 감기에 쉽게 걸려버린다.,그녀는 몸이 약한지 감기에 쉽게 걸려버린다.,그녀는 몸이 약한지 감기에 쉽게 걸려 버린다.
설마 이상한 짓 하는 건 아니겠지? 걱정된다. 얼른 들어와.,설마 이상한 짓 하는 건 아니겠지? 걱정된다 얼른 들어와!,설마 이상한 짓 하는 건 아니겠지 걱정된다. 얼른 들어와.,설마 이상한 짓 하는건 아니겠지? 걱정된다. 얼른 들어와.,철마 이상한 치하는 것 아니겠지 걱정된다 얼른 들러와,설마 이상한지 타는 건 아니겠지 걱정된다 얼른 들어와,설마 이상한 짓 하는 건 아니겠지 걱정된다 얼른 들어와.,철마 이상한 짓 하는 건 아니겠지 걱정된다 얼른 들어와.," 설마, 이상한 짓하는 건 아니겠지? 걱정된다. 얼른 들어와.",설마 이상한 짓 하는 건 아니겠지? 걱정된다. 얼른 들어와., 설마 이상한 주타는건 아니겠지? 걱정된다 얼른 들어와, 설마 이상한 짓 하는 건 아니겠지? 걱정된다 얼른 들어와, 설마 이상한 짓 하는 건 아니겠지 걱정된다 얼른 들어와.,설마 이상한 짓 하는 건 아니겠지 걱정된다. 얼른 들어와.,"설마 이상한 짓하는 건 아니겠지 걱정된다, 얼른 들어와."
되게 오랜만이네요. 어떻게 지내셨어요?,되게 오랜만이네요 어떻게 지내셨어요?,되게 오랜만이네요. 어떻게 지내셨어요?,되게 오랜만이네요. 어떻게 지내셨어요?,되게 오랫 만 이내어 어떻해 지해졌어요,"되게 오래만이네요, 어떻게 지내셨어요?",되게 오랜만이네요 어떻게 지내셨어요?,되게 오랜만이네요 어떻게 지내셨어요?, 되게 오랜만이네요. 어떻게 지내셨어요?,되게 오랜만이네요. 어떻게 지내셨어요?, 되게 오랜만이네요. 어떻게 지내셨어요?, 되게 오랜만이네요. 어떻게 지내셨어요?, 되게 오랜만이네요. 어떻게 지내셨어요?,되게 오랜만이네요. 어떻게 지내셨어요?,되게 오랜만이네요 어떻게 지내셨어요?
상품권으로 결제할 거고요. 현금 영수증 부탁드릴게요.,상품권으로 결제할 거고요 현금 영수증 부탁드릴게요,상품권으로 결제할 거구요 현금영수증 부탁드릴게요.,상품권으로 결제할 거구요 현금 영수증 부탁드릴게요,상품건으로 결제할고 구여 현금 영수 주는 부탁드리게여,"상품권으로 결제할 거고요, 현금 영수 등 부탁드릴게요.",상품권으로 결제할 거고요 현금영수증 부탁드릴게요.,상품권으로 결제할 거고요 현금영수증 부탁드릴게요.," 상품권으로 결제할 거고요, 현금 영수 중 부탁드릴게요.",상품권으로 결제할 거고요. 현금 영수증 부탁드릴게요., 상품 건으로 결제할 거고요. 현금 영수 중 부탁드릴게요., 상품권으로 결제할 거구요. 현금 영수증 부탁드릴게요., 상품권으로 결제할 거고요 현금영수증 부탁드릴게요.,상품권으로 결제할 거고요. 현금영수증 부탁드릴게요.,상품권으로 결제할 거구요. 현금 영수증 부탁드릴게요.
오래 기다리셨어요? 제가 너무 많이 늦은 건 아니죠?,오래 기다리 셨어요 제가 너무 많이 늦은 건 아니죠,오래 기다리셨어요. 제가 너무 많이 늦은 건 아니죠.,오래 기다리셨어요? 제가 너무 많이 늦은 건 아니죠?,오래게 달리셨어여 제가 넘무 많이는 증건 아니져,오래 기다리셨어요? 제가 너무 많이 늦은 건 아니죠?,오래 기다리셨어요 제가 너무 많이 늦은 건 아니죠?,오래 기다리셨어요 제가 너무 많이 늦은 건 아니죠?, 오래 기다리셨어요? 제가 너무 많이 늦은 건 아니죠.,오래 기다리셨어요? 제가 너무 많이 늦은 건 아니죠?, 오래 기다리셨어요? 제가 너무 많이 늦은 건 아니죠?, 오래 기다리셨어요? 제가 너무 많이 늦은 건 아니죠?, 오래 기다리셨어요? 제가 너무 많이 늦은 건 아니죠?,오래 기다리셨어요. 제가 너무 많이 늦은 건 아니죠.,오래 기다리셨어요 제가 너무 많이 늦은 건 아니죠
오늘은 선배랑 대화가 목적이었으니까 카페가 낫겠지?,오늘은 선배랑 대화가 목적 이었으니까 카페가 낫겠지,오늘은 선배랑 대화가 목적이었으니까 카페가 낫겠지?,오늘은 선배랑 대화가 목적이었으니까 카페가 낫겠지?,오늘은 선배랑 대가가 목적이었으니까 값패가 낫겠지,오늘은 선배랑 대화가 목적이었으니까 카페가 겠지?,오늘은 선배랑 대화가 목적이었다 카페가 낫겠지.,오늘은 선배랑 대화가 목적이었다 카페가 낫겠지., 오늘은 선배랑 대화가 목적이었으니까 카페가 낫겠지.,오늘은 선배랑 대화가 목적이었으니까 카페가 낫겠지?, 오늘은 선배랑 대화가 목적이었으니까 카페가 낫겠지, 오늘은 선배랑 대화가 목적이었으니까 카페가 낫겠지?, 오늘은 선배랑 대화가 목적이었으니까 카페가 낫겠지?,오늘은 선배랑 대화가 목적이었으니까 카페가 낫겠지.,오늘은 선배랑 대화가 목적이었으니까 카페가 낫겠지?
네 없어요. 오히려 좋은 전시같이 보자 해주셔서 감사해요.,"네, 없어요 오히려 좋은 전시 같이 보자 해 주셔서 감사해요",네 없어요? 오히려 좋은 전시 같이 보자 해주셔서 감사해요.,네 없어요. 오히려 좋은 전시 같이 보자 해주셔서 감사해요,내 없어여 오히에 좋은 전씨 갇치보자에 주셔서 감사하여,"네, 없어요. 오히려 좋은 전시 같이 보자 해주셔서 감사해요!",네 없어요 오히려 좋은 전시 같이 보자 해 주셔서 감사해요.,네 없어요 오히려 좋은 전시 같이 보자 해 주셔서 감사해요.," 네, 없어요. 오히려 좋은 전시 같이 보자 해 주셔서 감사해요.","네, 없어요. 오히려 좋은 전시 같이 보자 해 주셔서 감사해요.", 네 없어요. 오히려 좋은 전식 같이 모자 해주셔서 감사해요., 네 없어요. 오히려 좋은 전시 같이 보자 해주셔서 감사해요., 네 없어요. 오히려 좋은 전시 같이 보자 해주셔서 감사해요.,"네, 없어요. 오히려 좋은 전시 같이 보자해주셔서 감사해요.","네, 없어요, 오히려 좋은 전시 같이 보자해 주셔서 감사해요."
나는 웃음을 지으려고 했지만 이미 뺨이 굳어서 제대로 움직이지 않았다.,나는 웃음을 지으려고 했지만 이미 땀이 굳어서 제대로 움직이지 않았다.,나는 웃음을 지우려고 했지만 이미 뺨이 굳어서 제대로 움직이지 않았다.,나는 웃음을 지우려고 했지만 이미 뺨이 굳어서 제대로 움직이지 않았다.,나는 우숨을 주유려고 했지만 이미 뺨이 구도서 채들로 움직이지 않았다,나는 웃음을 지우려고 했지만 이미 이 어서 제대로 움직이지 않았다.,나는 웃음을 지으려고 했지만 이미 뺨이 굳어서 제대로 움직이지 않았다.,나는 웃음을 지우려고 했지만 이미 뺨이 굳어서 제대로 움직이지 않았다., 나는 웃음을 지우려고 했지만 이미 яб이 굳어서 제대로 움직이지 않았다.,나는 웃음을 지우려고 했지만 이미 뺨이 굳어서 제대로 움직이지 않았다., 나는 웃음을 지우려고 했지만 이미 뺨이 굳어서 제대로 움직이지 않았다., 나는 웃음을 지우려고 했지만 이미 뺨이 굳어서 제대로 움직이지 않았다., 나는 웃음을 지우려고 했지만 이미 뺨이 굳어서 제대로 움직이지 않았다.,나는 웃음을 지우려고 했지만 이미 뺨이 굳어서 제대로 움직이지 않았다.,나는 웃음을 지우려고 했지만 이미 뺨이 굳어서 제대로 움직이지 않았다.
올해 비 진짜 많이 오는 데 미리 제습기 사놓길 잘했다.,올해 비 진짜 많이 오는데 미리 진 습기 사 놓기 잘했다.,올해 비 진짜 많이 오는데 미리 제습기 사놓길 잘했다.,올해 비 진짜 많이 오는데 미리 제습기 사놓길 잘했다.,우래피 친자 많녀오는 데에 미이 제수기 사옥게 잘했다,올해 비 진짜 많이 오는데 미리 제스키 사놓기 잘했다.,올해 비 진짜 많이 오는데 미리 제습기 사 놓길 잘했다.,모레 비 진짜 많이 오는데 미리 제습기 사 놓게 잘했다., 올해 비 진짜 많이 오는데 미리 재습기 사 놓길 잘했다.,올해 비 진짜 많이 오는데 미리 제 새끼 사 놓길 잘했다., 오랫비 진짜 많이 오는데 미리 제습기 산호킬 잘했다., 올해 비 진짜 많이 오는데 미리 제스키 사놓길 잘했다, 올해 비 진짜 많이 오는데 미리 제습기 사놓길 잘했다.,올해 비 진짜 많이 오는데 미리 재습기 사놓길 잘했다.,올해 비 진짜 많이 오는데 미리 제습기 사 놓길 잘했다.
오늘 학교 졸업식인데 난 아직 학생이고 친구들 졸업하는데 마음이 붕 뜬다.,오늘 학교 졸업 식인데 난 아직 학생이고 친구들 졸업하는 데 마음이 봉 뜬다,오늘 학교 졸업식인데 난 아직 학생이고 친구들 졸업하는데 마음이 본뜬다.,오늘 학교 졸업식인데 난 아직 학생이고 친구들 졸업하는데 마음이 봉뜬다.,오늘 학교 조럽시인 데 단아직 하스에이이고 친고을 조럽하는데 마음이 봉든다,"오늘 학교 졸업식인데, 난 아직 학생이고 친구들이 졸업하는데 마음이 봉다",오늘 학교 졸업식인데 난 아직 학생이고 친구들 졸업하는데 마음이 봉 뜬다.,오늘 학교 졸업식인데 난 아직 학생이고 친구들 졸업하는데 마음이 붕 뜬다., 오늘 학교 졸업식인데 난 아직 학생이고 친구들 졸업하는데 마음이 봉든다.,오늘 학교 졸업식인데 난 아직 학생이고 친구들 졸업하는데 마음이 봉 뜬다., 오늘 학교 졸업식인데 난 아직 학생이고 친구들 졸업하는데 마음이 봉든다, 오늘 학교 졸업식인데 난 아직 학생이고 친구들 졸업하는데 마음이 봉 뜬다., 오늘 학교 졸업식인데 난 아직 학생이고 친구들 졸업하는데 마음이 봉 뜬다.,오늘 학교 졸업식인데 난 아직 학생이고 친구들 졸업하는데 마음이 봉 뜬다.,오늘 학교 졸업식인데 난 아직 학생이고 친구들 졸업하는데 마음이 벙 뜬다.
에이 애도 아니고. 유치하게 선배가 계속 속 좁게 그러겠어?,"에이, 애도 아니고 유치하게 선배가 계속 속 좁게 그러겠어",에이 애도 아니고 유치하게 선배가 계속 속 좁게 그러겠어?,에이 애도 아니고 유치하게 선배가 계속 속 좁게 그러겠어,에이또아니고 유치하게 선배가 계속 폭접게 그록했써,"에이, 애도 아니고 유치하게 선배가 계속 속게 그러겠어.",에이 애도 아니고 유치하게 선배가 계속 속 좁게 그러겠어.,에이 애도 아니고 유치하게 선배가 계속 속 좁게 그러겠어.," 에이, 애도 아니고, 유치하게 선배가 계속 속게 그러겠어.","에이, 얘도 아니고 유치하게 선배가 계속 속 좁게 그러겠어."," 에이, 애도 아니고 유치하게 선배가 계속 속족하게 그렇게 써.", 에이 애도 아니고 유치하게 선배가 계속 속 좁게 그러겠어, 에이 애도 아니고 유치하게 선배가 계속 속 좁게 그러겠어.,에이 애도 아니고 유치하게 선배가 계속 속좁게 그러겠어.,"에이, 애도 아니고 유치하게 선배가 계속 속 좁게 그러겠어."
오늘 회식은 내가 쏠 거니깐 많이 먹어.,오늘 회식은 내가 쏠 거니깐. 많이 먹어.,오늘 회식은 내가 쏠 거니깐 많이 먹어?,오늘 회식은 내가 쏠 거니깐 많이 먹어.,오늘 회식은 내가 술건 있간 많이어고,오늘 회식은 내가 거리니까 많이 먹어!,오늘 회식은 내가 쏠 거니깐 많이 먹어.,오늘 회식은 내가 쏠 거니깐 많이 먹어., 오늘 회식은 내가 쏠 거니깐 많이 먹어.,오늘 회식은 내가 쏠 거니까 많이 먹어., 오늘 회식은 내가 쏠 거니까 많이 먹어, 오늘 회식은 내가 쏠 거니까 많이 먹어., 오늘 회식은 내가 쏠 거니깐 많이 먹어.,오늘 회식은 내가 쏠 거니깐 많이 먹어.,오늘 회식은내가 쏠거니깐 많이 먹어
제 코트에 보풀이 너무 많이 생겨서 수선하러 왔어요.,제 코트에 보풀이 너무 많이 생겨서 수선 하러 왔어요,제 코트에 보풀이 너무 많이 생겨서 수선하러 왔어요.,제 코트에 보풀이 너무 많이 생겨서 수선하러 왔어요,제 코트에 보프이 넘무 많이 생겨서 수손화로 왔어여,제 코트에 보풀이 너무 많이 생겨서 수선하러 왔어요.,제 코트에 보풀이 너무 많이 생겨서 수선화로 왔어요.,제 코트에 보풀이 너무 많이 생겨서 수선화로 왔어요., 제 코트에 보플이 너무 많이 생겨서 수선하러 왔어요.,제 코트에 보풀이 너무 많이 생겨서 수선하러 왔어요., 제 코트에 복풀이 너무 많이 생겨서 수선하러 왔어요, 제 코트에 보풀이 너무 많이 생겨서 수선하러 왔어요, 제 코트에 보풀이 너무 많이 생겨서 수선하러 왔어요.,제 코트에 보풀이 너무 많이 생겨서 수선하러 왔어요.,제 코트에 보풀이 너무 많이 생겨서 수선하러 왔어요
그나저나 어쩌다 둘이서 같이 저녁을 먹게 된 거야? 의외의 조합이네.,그나저나 어쩌다 둘이서 같이 저녁을 먹게 된 거야? 이 왜 조합이? 네,그나저나 어쩌다 둘이서 같이 저녁을 먹게 된 거야. 의외의 조합이네.,그나저나 어쩌다 둘이서 같이 저녁을 먹게 된 거야? 의외의 조합이네?,그나전나 어쩔다 두리서 같치 전역을 먹에된 거야 의외의조아이내,그나저나 어다 둘이서 같이 저녁을 먹게 된 거야 의외 조합이네,그나저나 어쩌다 둘이서 같이 저녁을 먹게 된 거야 의회 조합이네.,그나저나 어쩌다 둘이서 같이 저녁을 먹게 된 거야., 그나저나 어쩌다 둘이서 같이 저녁을 먹게 된 거야? 의회의 조합이네.,그나저나 어쩌다 둘이서 같이 저녁을 먹게 된 거야? 의외의 조합이네., 그나저나 어쩌다 둘이서 같이 저녁을 먹게 된거야? 왜 조합이네?, 그나저나 어쩌다 둘이서 같이 저녁을 먹게 된 거야? 의외의 조합이네?, 그나저나 어쩌다 둘이서 같이 저녁을 먹게 된 거야 의외의 조합이네,그나저나 어쩌다 둘이서 같이 저녁을 먹게 된 거야. 위외의 조합이네.,그나저나 어쩌다 둘이서 같이 저녁을 먹게 된 거야? 의외의 조합이네?
어. 나 감기 걸렸나 봐. 어제부터 목이 너무 아파. 침 삼킬 때마다 막 따끔거려.,"어, 나 감기 걸렸나 봐 어제부터 목이 너무 아파 칭찬 킬 때마다 막 따끔 거려",어 나 감기 걸렸나봐. 어제부터 목이 너무 아파 침장 필 때마다 막 따끔거려.,어 나 감기 걸렸나봐. 어제부터 목이 너무 아파. 침 삼킬 때마다 막 따끔거려.,오원다 감기 골년나바 오제부터 무기 도무앞파 침상 펼대마다 막닥끔거려,"오, 나 감기 걸렸나 봐, 어제부터 목이 너무 아파, 침상  때마다 막 거려.",어 나 감기 걸렸나 봐 어제부터 목이 너무 아파 침 삼킬 때마다 막 따끔거려.,어 나 감기 걸렸나 봐 어제부터 목이 너무 아파 침 삼킬 때마다 막 따끔거려.," 어, 나 감기 걸렸나 봐. 어제부터 목이 너무 아파. 침상힐 때마다 막 따끔거려.","어, 나 감기 걸렸나 봐. 어제부터 목이 너무 아파. 침 삼킬 때마다 막 따끔거려.", 어 나 감기 걸렸나봐 어제부터 목이 너무 아파 침상필 때마다 막 닦은 거려, 어 나 감기 걸렸나봐 어제부터 목이 너무 아파 침 상태때마다 막 따끔거려, 어 나 감기 걸렸나 봐. 어제부터 목이 너무 아파. 침 삼킬 때마다 따끔거려.,"어, 나 감기 걸렸나봐. 어제부터 목이 너무 아파 침창 필 때마다 막 따끔거려 뜨.",어 나 감기 걸렸나봐. 어제부터 목이 너무 아파. 침 삼킬 때마다 막 따끔거려.
남의 연애사 별로 관심 없으니까 그만 얘기해도 돼.,남의 연애사 별로 관심 없으니까 그만 얘기해도 돼,남해 연애사 별로 관심 없으니까 그만 얘기해도 돼?,남의 연애사 별로 관심 없으니까 그만 얘기해도 돼.,남의 연해사 별로 관심 없으니까 그만 예기에 도 대에,남의 연애사 별로 관심이 없으니까 그만 얘기해도 돼,남의 연애사 별로 관심 없으니까 그만 얘기해도 돼.,남해 연애사 별로 관심 없으니까 그만 얘기해도 돼., 남의 연애사 별로 관심 없으니까 그만 얘기해도 돼.,남의 연애사 별로 관심 없으니까 그만 얘기해도 돼., 남의 연애사 별로 관심 없으니까 그만 얘기해도 돼, 남의 연애사 별로 관심 없으니까 그만 얘기해도 돼, 남의 연애사 별로 관심 없으니까 그만 얘기해도 돼.,남의 연애사 별로 관심 없으니까 그만 얘기해도 돼.,남의 연애사 별로 관심 없으니까 그만 얘기해도 돼.
오늘은 집에서 텔레비전도 보고 뒹굴뒹굴 쉴 거야.,오늘은 집에서 텔레비전도 보고 둥글둥글 쉴 거야,오늘은 집에서 텔레비전도 보고 뒹굴뒹굴 쉴 거야?,오늘은 집에서 텔레비전도 보고 뒹굴뒹굴 쉴 거야.,오늘은 집에서 텔레비전도 보고 등굴등골 실과야,오늘은 집에서 텔레비전도 보고 딩글딩글 을 거야.,오늘은 집에서 텔레비전도 보고 뒹굴뒹굴 쉴 거야.,오늘은 집에서 텔레비전도 보고 뒹굴뒹굴 쉴 거야., 오늘은 집에서 텔레비전도 보고 딩글딩글 쉴 거야.,오늘은 집에서 텔레비전도 보고 딩글딩글 쉴 거야., 오늘은 집에서 텔레비전도 보고 딩글딩글 쉴거야, 오늘은 집에서 텔레비전도 보고 딩글딩글 쉴 거야, 오늘은 집에서 텔레비전도 보고 뒹굴뒹굴 쉴 거야.,오늘은 집에서 텔레비전도 보고 뒹글뒹굴 쉴 거야.,오늘은 집에서 텔레비전도 보고 뒹굴뒹굴 쉴 거야.
같이 맞벌이하는데 집안일은 내가 더 많이 하는 것 같아.,같이 맞벌이 하는데 집안 일은 내가 더 많이 하는 것 같아.,같이 맞벌이하는데 집안일은 네가 더 많이 하는 거 같아?,같이 맞벌이 하는데 집안일은 내가 더 많이 하는 것 같아.,갇이 맛버리하는 데에 집반일은 대가 더 많이하는 것 같다,같이 맞벌이하는데 집안일은 내가 더 많이 하는 것 같아.,같이 맞벌이 하는데 집안일은 내가 더 많이 하는 거 같아.,같이 맞벌이 하는데 집안일은 내가 더 많이 하는 거 같아., 같이 맛벌이 하는데 집안 일은 내가 더 많이 하는 거 같아.,같이 맛벌이 하는데 집안일은 내가 더 많이 하는 거 같아., 같이 맞벌이하는데 집안이는 내가 더 많이 하는 것 같아., 같이 맞벌이 하는데 집안일은 내가 더 많이 하는 것 같아., 같이 맞벌이하는데 집안일은 내가 더 많이 하는 거 같아.,같이 맞벌이 하는데 집안일은 내가 더 많이 하는 것 같아.,같이 맞벌이하는데 집안일은 내가 더 많이 하는 거 같아.
이번 주 일요일부터 산에 가기로 했어.,이번 주 일요일부터 산에 가기로 했어,이번 주 일요일부터 산에 가기로 했어.,이번 주 일요일부터 산에 가기로 했어.,2먼주 이루일 부터 산에 가기로했소,이번 주 일요일부터 산에 가기로 했어!,이번 주 일요일부터 산에 가기로 했어.,이번 주 일요일부터 산에 가기로 했어., 이번 주 일요일부터 산에 가기로 했어.,이번 주 일요일부터 산에 가기로 했어., 이번 주 2주 1부터 산에 가기로 했어., 이번 주 일요일부터 산에 가기로 했어., 이번 주 일요일부터 산에 가기로 했어.,이번 주 일요일부터 산에 가기로 했어.,이번주 일요일부터 산에 가기로 했어.
배도 불러서 후식으로 커피를 먹을 거예요.,배도 불러서 후식으로 커피를 먹을 거예요.,배도 불러서 후식으로 커피를 먹을 거예요.,배도 불러서 후식으로 커피를 먹을 거에요,배도 불러서 후식으로 커피를 먹을 거해요,배도 불러서 후식으로 커피를 먹을 거예요.,배도 불러서 후식으로 커피를 먹을 거예요.,배도 불러서 후식으로 커피를 먹을 거예요., 배도 불러서 후식으로 커피를 먹을 거예요.,배도 불러서 후식으로 커피를 먹을 거예요., 배도 불러서 후식으로 커피를 먹을거에요, 배도 불러서 후식으로 커피를 먹을 거예요., 배도 불러서 후식으로 커피를 먹을 거예요.,배도 불러서 후식으로 커피를 먹을 거예요.,배도 불러서 후식으로 커피를 먹을거예요.
그건 나도 확실히 모르겠어.,그건 나도 확실히 모르겠어,그건 나도 확실히 모르겠어?,그건 나도 확실히 모르겠어.,최원나도 확시이 물르 길소,그건 나도 확실히 모르겠어,그건 나도 확실히 모르겠어.,그건 나도 확실히 모르겠어., 그건 나도 확실히 모르겠어.,그건 나도 확실히 모르겠어., 그건 나도 확실히 모르겠어, 그건 나도 확실히 모르겠어, 그건 나도 확실히 모르겠어,그건 나도 확실히 모르겠어.,그건 나도 확실히 모르겠어.
