cleand_text,amazon_transcribe,azure,azure_whisper,mms,seamless,V1_latest_short,V2_short,V2_chirp,V2_chirp_2,whisper_base,whisper_medium,whisper_turbo,리턴제로(vito),한국전자통신연구원(etri)
소방당국은 지하철 역사 안 환풍기 시설 안으로 전선에 불이 붙은 것으로 보고 정확한 원인을 파악하고 있습니다.,소방 당국은 지하철 역사 안 환풍기 시설 안에서 전선에 불이 붙은 것으로 보고 정확한 원인을 파악하고 있습니다.,소방당국은 지하철역 사안 환 환풍기 시설 안에서 전선에 불이 붙은 것으로 보고 정확한 원인을 파악하고 있습니다.,소방당국은 지하철 역사 안 환풍기 시설 안에서 전선에 불이 붙은 것으로 보고 정확한 원인을 파악하고 있습니다.,소방당국은 지하철 역사 안 환풍기 시설 안에서 전선의 부의부은 것으로 보고 정확한 원인을 파학하고 있습니다,소방 당국은 지하철 역사 안 환풍기 시설 안에서 전선에 불이 붙은 것으로 보고 정확한 원인을 파악하고 있습니다.,소방당국은 지하철 역사 안 환풍기 시설 안에서 전선에 불이 붙은 것으로 보고 정확한 원인을 파악하고 있습니다.,소방당국은 지하철 역사 안 환풍기 시설 안에서 전선에 불이 붙은 것으로 보고 정확한 원인을 파악하고 있습니다., 소방 당국은 지하철 역사 안 환풍기 시설 안에서 전선의 불이 붙은 것으로 보고 정확한 원인을 파악하고 있습니다.,소방당국은 지하철 역사안 환풍기 시설 안에서 전선에 불이 붙은 것으로 보고 정확한 원인을 파악하고 있습니다., 소방당국은 지하철 역사한 한풍기 시사를 안 해서 전선에 불이 붙은 것으로 보고 정확한 원인을 파악하고 있습니다., 소방당국은 지하철 역사 안 환풍기 시설 안에서 전선에 불이 붙은 것으로 보고 정확한 원인을 파악하고 있습니다., 소방당국은 지하철 역사 안 환풍기 시설 안에서 전선에 불이 붙은 것으로 보고 정확한 원인을 파악하고 있습니다.,소방당국은 지하철 역사안 환풍기 시설 안에서 전선에 불이 붙은 것으로 보고 정확한 원인을 파악하고 있습니다.,소방 당국은 지하철 역사 안 환풍기 시설 안에서 전선에 불이 붙은 것으로 보고 정확한 원인을 파악하고 있습니다.
이 바지는 헐렁해서 벨트를 꼭 매야 편해.,이 바지는 홀랑 에서 벨트를 꼭 내야 편해,이 바지는 헐렁해서 벨트를 꼭 메야 편해.,이 바지는 헐렁해서 벨트를 꼭 매야 편해.,이 바지는 헐랑에서 벨트를 공 매야 편해,이 바지는 랑에서 벨트를 꼭 매야 편해.,이 바지는 헐렁해서 벨트를 꼭 매야 편.,이 바지는 헐렁해서 벨트를 꼭 메야 편., 이 바지는 헐렁에서 벨트를 꼭 매야 편해.,이 바지는 헐렁해서 벨트를 꼭 매야 편해., 이 바지는 홀랑에서 벨트를 꼭 매야 편해., 이 바지는 헐렁해서 벨트를 꼭 메야 편해, 이 바지는 헐렁해서 벨트를 꼭 매야 편해.,이 바지는 헐렁해서 벨트를 꼭 매야 편해.,이 바지는 헐렁해서 벨트를 꼭 매야 편해.
나 오늘 첫 끼라서 많이 못 먹을 거 같아.,나 오늘 초기라서 많이 못 먹을 거 같아,나 오늘 첫기라서 많이 못 먹을 것 같아?,나 오늘 첫끼라서 많이 못먹을 것 같아,다 원늘 척기나서 많이 문먹을 고 같다,나 오늘 기라서 많이 못 먹을 것 같아.,나 오늘 적기라 많이 못 먹을 거 같아.,나 오늘 첫 끼라 많이 못 먹을 거 같아., 나 오늘 적기라서 많이 못 먹을 거 같아.,나 오늘 적기라서 많이 못 먹을 거 같아., 나 오늘 적기라서 많이 못 먹을 것 같아, 나 오늘 첫끼라서 많이 못먹을 것 같아, 나 오늘 첫 끼라서 많이 못 먹을 거 같아.,나 오늘 척끼라서 많이 못 먹을 거 같아.,나 오늘 적기라서 많이 못 먹을 것 같아.
방금 엄청 맛있는 계란 토스트를 만들었어.,방금 엄청 맛있는 계란 토스트를 만들었어,방금 엄청 맛있는 계란 토스트를 만들었어?,방금 엄청 맛있는 계란 토스트를 만들었어.,방근 엄청마시는 개란 토스들을 만들었소,방금 엄청 맛있는 계란 토스트를 만들었어.,방금 엄청 맛있는 계란 토스트를 만들었어.,방금 엄청 맛있는 계란 토스트를 만들었어., 방금 엄청 맛있는 계란 토스트를 만들었어.,방금 엄청 맛있는 계란 토스트를 만들었어., 방금 엄청 맛있는 계란 토스트를 만들었어, 방금 엄청 맛있는 계란 토스트를 만들었어, 방금 엄청 맛있는 계란 토스트를 만들었어.,방금 엄청 맛있는 계란 토스트를 만들었어.,방금 엄청 맛있는 계란 토스트를 만들었어.
넌 취업 준비 잘 돼가나? 자기소개서 써야지 이제.,넌 취업 준비 잘 되잖아 자기 소개서 써야지 이제,넌 취업 준비 잘 돼가나 자기소개서 써야지 이제.,넌 취업준비 잘되가나? 자기소개서 써야지 이제,너 취업쯤비 잘대가나 자기 속에 서어야지자에,"넌 취업 준비 잘 되거든, 자기 속에서 써야지 이제",넌 취업 준비 잘 돼 가나 자기소개서 써야지 이제.,넌 취업 준비 잘 돼 가나 자기소개서 써야지 이제., 넌 취업 준비 잘 되가? 자기 속에서 써야지 이제.,"넌 취업 준비 잘 되어 가나? 자기 속에서 써야지, 이제.", 넌 취업 준비 잘 되잖아 자기 속에서 써야지 이제, 넌 취업준비 잘 돼가나? 자기소개서 써야지 이제, 넌 취업 준비 잘 돼가나? 자기소개서 써야지 이제.,"넌 취업 준비 잘 되가나, 자기 소개서 써야지 이잘.",넌 취업 준비 잘 되가나 자기소개서 써야지 잘.
옆방에서 기타 연습을 하고 있어요.,옆방에서 기타 연습을 하고 있어요,옆방에서 기타 연습을 하고 있어요.,옆방에서 기타 연습을 하고 있어요.,욥방에서 기타연 습을 하고 있도여,방에서 기타 연습을 하고 있어요!,옆방에서 기타 연습을 하고 있어요.,옆방에서 기타 연습을 하고 있어요., 옆방에서 기타 연습을 하고 있어요.,옆방에서 기타 연습을 하고 있어요., 옆방에서 기타 연습을 하고 있어요, 옆방에서 기타 연습을 하고 있어요., 옆방에서 기타 연습을 하고 있어요.,옆방에서 기타 연습을 하고 있어요.,옆방에서 기타 연습을 하고 있어여
머리둘레가 이상한 지 6번이나 다시 쟀어.,머리 둘레가 이상한 지 여섯 번이나 다시 재어,머리둘레가 이상한지 여섯 번이나 다시 쟀어?,머리둘레가 이상한지 여섯 번이나 다시 쟀어.,머리둘레가 이상안지 여섯번이나 다시재소,머리 돌레가 이상한지 여섯 번이나 다시 어.,머리 둘레가 이상한지 여섯 번이나 다시 쟀는데.,머리 둘레가 이상한지 여섯 번이나 다시 재 써., 머리 둘레가 이상한 지 여섯 번이나 다시 됐어.,머리 둘레가 이상한지 여섯 번이나 다시 <0xEC><0x9F><0x80>어., 머리 돌려가 이상한지 6번이나 다시 잤어, 머리둘레가 이상한지 6번이나 다시 재써, 머리둘레가 이상한지 6번이나 다시 쟀어.,머리둘레가 이상한지 여섯 번이나 다시 쟀어.,머리 둘레가 이상한지 여섯번이나 다시 쟀어.
어젯밤에 모기한테 완전 테러 당했어.,어젯밤에 무기한 테 완전 테러 당했어.,어젯밤에 모기한테 완전 테러 당했어?,어젯밤에 모기한테 완전 테러당했어,확제밤에 모기 안태 완전 태로당했소,어밤에 모기한테 완전 테러당했어.,어젯밤에 모기한테 완전 테러 당했어.,어젯밤에 모기한테 완전 테러 당했어., 어젯밤에 모기한테 완전 테러 당했어.,어젯밤에 모기한테 완전 테러 당했어., 어차피 목이한테 완전 태로 당했어., 어젯밤에 모기한테 완전 테러 당했어., 어젯밤에 모기한테 완전 테러 당했어.,어젯밤에 모기한테 완전 테러당했어.,어젯밤에 모기한테 완전 테러당했어.
그렇지만 불법 주차하는 사람이 많아.,그렇지만 불법 추천하는 사람이 많아,그렇지만 불법 주차하는 사람이 많아.,그렇지만 불법 주차하는 사람이 많아.,그렇지만 불법 자을 사람이 많아,그렇지만 불법 주차하는 사람이 많아.,그렇지만 불법 추천하는 사람이 많아.,그렇지만 불법 추천하는 사람이 많아., 그렇지만 불법 주차하는 사람이 많아.,그렇지만 불법 주차하는 사람이 많아., 그렇지만 불법 주찬을 사람이 많아, 그렇지만 불법 주차하는 사람이 많아., 그렇지만 불법 주차하는 사람이 많아.,그렇지만 불법 주차하는 사람이 많아.,그렇지만 불법 주차하는 사람이 많아.
수상자가 발표되기 전까지 떨고 있을 거예요.,수상자가 발표 되기 전까지 떨고 있을 거예요.,수상자가 발표되기 전까지 떨고 있을 거예요.,수상자가 발표되기 전까지 떨고 있을 거에요,수상다가 발표대이 정가지 떨고있을거해요,수상자가 발표되기 전까지 떨고 있을 거예요.,수상자가 발표되기 전까지 떨고 있을 거예요.,수상자가 발표되기 전까지 떨고 있을 거예요., 수성다가 발표되기 전까지 떨고 있을 거예요.,수상자가 발표되기 전까지 떨고 있을 거예요., 수성다가 발표되기 전까지 떨고 있을 거예요, 수상자가 발표되기 전까지 떨고 있을 거예요., 수상자가 발표되기 전까지 떨고 있을 거예요.,수성자가 발표되기 전까지 떨고 있을 거예요.,수정자가 발표되기 전까지 떨고 있을 거에요.
술을 너무 많이 마셔서 그냥 두고 왔어.,술을 너무 많이 마셔서 그냥 두고 왔어.,술을 너무 많이 마셔서 그냥 두고 왔어?,술을 너무 많이 마셔서 그냥 두고 왔어.,술를 농무 많이마셔서 그냥 두고았쓰도,술을 너무 많이 마셔서 그냥 두고 왔어,술을 너무 많이 마셔서 그냥 두고 왔어.,술을 너무 많이 마셔서 그냥 두고 왔어., 술을 너무 많이 마셔서 그냥 두고 왔어.,술을 너무 많이 마셔서 그냥 두고 왔어., 술을 너무 많이 마셔서 그냥 두고 왔어, 술을 너무 많이 마셔서 그냥 두고 왔어, 술을 너무 많이 마셔서 그냥 두고 왔어.,술을 너무 많이 마셔서 그냥 두고 왔어.,술을 너무 많이 마셔서 그냥 두고 왔어.
뭐 보고 있어? 이게 그렇게 재밌어?,뭐 보고 있어? 이게 그렇게 재밌어?,뭐 보고 있어 이게 그렇게 재밌어?,뭐 보고 있어? 이게 그렇게 재밌어?,모보고 있라 이게 그렇게 재밀다,뭐 보고 있어? 이게 그렇게 재미있어?,뭐 보고 있어 이게 그렇게 재밌어.,뭐 보고 있어?, 뭐 보고 있어? 이게 그렇게 재밌어?,뭐 보고 있어? 이게 그렇게 재밌어?, 뭐 보고 있어? 이게 그렇게 재밌어, 뭐 보고 있어? 이게 그렇게 재밌어?, 뭐 보고 있어? 이게 그렇게 재밌어?,뭐 보고 있어 이게 그렇게 재밌어.,뭐 보고 있어? 이게 그렇게 재밌어?
야 종이는 일반 쓰레기가 아니고 재활용 쓰레기지 빨리 주워 담아.,"야, 종이는 일반 쓰레기가 아니고 재활용 쓰레기지 빨리 주어 다아",야 종이는 일반 쓰레기가 아니고 재활용 쓰레기지 빨리 주워담아.,야 종이는 일반 쓰레기가 아니고 재활용 쓰레기지 빨리 주워 담아,야 종인의 일반 스리기가 아에고 재하형 스에기지 빨추어다마,-(인터뷰) 종이는 일반 쓰레기가 아니고 재활용 쓰레기지 빨수다마,야 종이는 일반 쓰레기가 아니고 재활용 쓰레기지 빨리 주워 담아.,야 종이는 일반 쓰레기가 아니고 재활용 쓰레기지 빨리 지워 담아.," 야, 종이는 일반 쓰레기가 아니고 재활용 쓰레기지. 빨리 주어 담아.","야, 종이는 일반 쓰레기가 아니고 재활용 쓰레기지. 빨리 주워 담아.", 야 종이는 일반 쓰레기가 아니고 재활용 쓰레기지 빨리 주오다 마, 야 종이는 일반 쓰레기가 아니고 재활용 쓰레기지 빨리 주워 담아, 야 종이는 일반 쓰레기가 아니고 재활용 쓰레기지 빨리 주워 담아,"야, 종이는 일반 쓰레기가 아니고 재활용 쓰레기지 빨리 주워담아.",야 종이는 일반 쓰레기가 아니고 재활용 쓰레기지. 빨리 주워담아.
초고속 충전은 정말 빠른 것 같아요.,초고속 충전은 정말 빠른 것 같아요,초고속 충전은 정말 빠른 것 같아요.,초고속 충전은 정말 빠른 것 같아요,초고속 충전은 정말 빠른것 같하요,초고속 충전은 정말 빠른 것 같아요.,초고속 충전은 정말 빠른 것 같아요.,초고속 충전은 정말 빠른 것 같아요., 초고속 충전은 정말 빠른 것 같아요.,초고속 충전은 정말 빠른 것 같아요., 초고속 충전은 정말 빠른 것 같아요, 초고속 충전은 정말 빠른 것 같아요, 초고속 충전은 정말 빠른 것 같아요.,초고속 충전은 정말 빠른 것 같아요.,초고속 충전은 정말 빠른 것 같아요.
안경에 김 서린 거 봐. 아무것도 안 보이네.,안경이 김 설인 가 봐 아무것도 안 보이네.,안경이 김서린 거 봐 아무것도 안 보이네?,안경이 김설인 거 봐 아무것도 안 보이네,악경의 김설린거아 암것다 안보인해,"안경에 김설인 거바, 아무것도 안 보이네?",안경에 김서린 거 봐 아무것도 안 보이네.,안경에 김서린 거 봐.," 안경에 김설인 거 봐, 아무것도 안 보이네.",안경이 김설인 거 봐. 아무것도 안 보이네., 안경의 김설인 것 봐 아무것도 안 보이네, 안경이 김설인거봐 아무것도 안보이네, 안경이 김설인 거 봐. 아무것도 안 보이네.,안경에 김설인가 봐 아무것도 안 보이네.,안경이 김설인가 봐 아무것도 안 보이네.
이쪽에 장미가 있어요.,이쪽에 장미가 있어요,이쪽에 장미가 있어요.,이쪽에 장미가 있어요,2쪽의 장미가 2소유,이쪽에 장미가 있어요,이쪽에 장미가 있어요.,이쪽에 장미가 있어요., 이쪽에 장미가 있어요.,이쪽에 장미가 있어요., 이쪽에 장미가 있어요, 이쪽에 장미가 있어요., 이쪽에 장미가 있어요.,이쪽에 장미가 있어요.,이쪽에 장미가 있어요.
그래서 이 책만으로 나에게 충분하지 않아.,그래서 이 책 만으로는 나에게 충분하지 않아,그래서 이 책만으로는 나에게 충분하지 않아?,그래서 이 책만으로는 나에게 충분하지 않아.,레소 이 책만으로는 나에게 충분하지 않아,그래서 이 책만으로는 나에게 충분하지 않아.,내서이 책만으로는 나에게 충분하지 않아.,이 책만으로는 나에게 충분하지 않아., 그래서 이 책만으로는 나에게 충분하지 않아.,그래서 이 책만으로는 나에게 충분하지 않아., 그래서 이 책만으로는 나에게 충분하지 않아., 그래서 이 책만으로는 나에게 충분하지 않아., 그래서 이 책만으로는 나에게 충분하지 않아.,그래서 이 책만으로는 나에게 충분하지 않아.,그래서 이 책만으로는 나에게 충분하지 않아.
떡볶이 사다줄까? 순대 사다줄까? 뭐 먹고 싶어?,떡볶이 사다 줄까? 순대 사다 줄까? 뭐 먹고 싶어?,떡볶이 사다 줄까 순대 사다 줄까 뭐 먹고 싶어?,떡볶이 사다 줄까 순대 사다 줄까 뭐 먹고 싶어,덕폭히 사다주가 순대 사다주가 머먹구 싶퍼, 기 사다가 순대 사다가 뭐 먹고 싶어?,떡볶이 사다 줄까 순대 사다 줄까 뭐 먹고 싶어.,떡볶이 사다 줄까 순대 사다 줄까 뭐 먹고 싶어., 떡볶이 사다 줄까? 순대 사다 줄까? 뭐 먹고 싶어?,떡볶이 사다 줄까? 순대 사다 줄까? 뭐 먹고 싶어?," 떡볶이 사다 줄까, 순대 사다 줄까 뭐 먹고 싶어", 떡볶이 사다 줄까? 순대 사다 줄까? 뭐 먹고 싶어?, 떡볶이 사다 줄까 순대 사다 줄까 뭐 먹고 싶어?,"떡볶이 사다줄까, 순대 사다줄까 뭐 먹고 싶어.",떡볶이 사다 줄까? 순대 사다 줄까? 뭐 먹고 싶어?
얘 편지 쓴 거 봐 한글도 잘 써. 완전 한국 사람이야.,얘 편지 쓴 거 봐 한글도 잘 써 완전 한국 사람이야,예 편지 쓴 거 봐 한글도 잘 써 완전 한국 사람이야.,얘 편지 쓴 거 봐. 한글도 잘 써. 완전 한국 사람이야.,예 편짓쓴거아 항을도 잘써 완전 항코사라면,"예 편지 쓴 거바, 한글도 잘 쓰, 완전 한국 사람이야!",얘 편지 쓴 거 봐 한글도 잘 써 완전 한국 사람이야.,얘 편지 쓴 거 봐 한글도 잘 써 완전 한국 사람이야.," 얘 편지 쓴 거 봐, 한글도 잘 써, 완전 한국 사람이야.","예, 편지 쓴 거 봐. 한글도 잘 써. 완전 한국 사람이야."," 예편 치슨거봐, 한국에도 잘 써. 완전 한국 사람이야.", 얘 편지 쓴 거 봐. 한글도 잘 써. 완전 한국 사람이야., 얘 편지 쓴 거 봐. 한글도 잘 써. 완전 한국 사람이야.,"얘 편지 쓴 거 봐, 한글도 잘 써 완전 한국 사람이야.",얘 편지 쓴 거 봐. 한글도 잘 써. 완전 한국 사람이야.
